16 a. namų valda;Alytus, Vidzgirio g.;249 000 €
Rąstinė sodyba Šakių r. Lukšių sen.;Šakių raj., Stalioriai;49 000 €
Skubiai neįrengtą namą Marijampolėje Kaiščiunu gyvenvietėje 064509793;Kaunas, Kaisčiunų gyvenvietė;
Pard.Vilkaviškio Rajone Mūrinis Namas Su Ūkiniais Pastatais, Žemės Sklypu 25,13a;Vilkaviškio raj., Matlaukio gyv.;22 500 €
Parduodamas gyvenamasis namas Alytuje, Senamiestyje, Vidzgirio g.;Alytus, Vidzgirio g.;249 000 €
Parduodamas gyvenamasis namas Pasvalio rajone, Vilkiškių kaime, Svalios g. 8;Pasvalio raj., Vilkiškių k ...;21 000 €
PUIKIAI ĮRENGTAS NAMAS Ignalinos r.;Ignalinos raj., Rimšė;110 000 €
Sodyba/vienkiemis Joniškio r. sav.;Joniškio raj.;42 000 €
Renovuota Sodyba - vienkiemis Jurbarko raj.;Jurbarko raj.;39 000 €
Namas Teizų k. Lazdijų raj.;Lazdijai;28 000 €
Sodo namas Radviliškyje;Radviliškis;41 000 €
Išskirtinis sklypas su poilsio namu ežero pakrantėje;Zarasai;39 900 €
Puikiai atnaujintas Namas Alytaus r.;Alytaus raj., Balkūnų k;94 000 €
PARDUODAMA SODYBA ANYKŠČIŲ R. SAV.;Anykščių raj., Šližių k.;20 000 €
Puikiai įrengtas gyvenamas sodo namas Kauno r. sav.,;Kauno raj., Gervenupis;79 000 €
Erdvus NAMAS šalia Miško;Panevėžys;143 000 €
Mūrinis namas Marijampolės r. Varnupių k.;;15 000 €
Namas Prienu sav., Lielioniu k.;Prienų raj.;32 000 €
Apmūrytas namas Radviliškio rajone, Baisogaloje;Radviliškio raj., Baisogala;20 000 €
NAMAS SU PRŪDU VILKAVIŠKIO RAJ.;Vilkaviškio raj., Dailuciai;30 800 €
Įrenginėjamas mūrinis namas Kėdainių r.;Kėdainių raj., Pašušvė;22 999 €
Namas - Lazdiju r. Rudaminoje;Lazdijų raj., Rudamina;34 000 €
Mūrinis namas su dirbtuvėmis Mažeikių raj.;Mažeikių raj., Viekšniai;52 000 €
Sodyba Kretingos rajone, Erlėnų k;Kretingos raj., Erlenai;25 000 €
Rąstinis namas Pasvalio r. Mitrišiūnų k.;Pasvalio raj.;25 000 €
VIP NAMAI. Sklypas+Namas (visa apdailą). Nuo 100m2 - 150m2 - 170m2 iki 200m2 (340m2);Akmenės raj., Naujoji Akmenės ...;80 000 €
Panevėžio r. sav., Šeškų k., Kreivoji g.;Panevėžio raj., šeškų k. kreivoji g ...;50 000 €
Parduodu sodyba Moletu raj.;Molėtų raj., Girsteikiskio km ...;40 000 €
RAMIOJE NAUJOSIOS AKMENĖS MIESTO VIETOJE PARDUODAMAS ĮRENGTAS GYVENAMASIS NAMAS SU ATSKIRU SVEČIŲ NAMU;Akmenė, Naujoji Akmenė;95 000 €
GAMTOS IR RAMYBĖS OAZĖ NAUJOSIOS AKMENĖS MIESTE;Akmenė, NAUJOJI AKMENĖ;115 000 €
Kruopiuose parduodamas erdvus gyvenamasis namas su 31 aro žemės sklypu;Akmenė, KRUOPIAI;40 000 €
Naujosios Akmenės mieste parduodamas rąstų- apmūrytas gyvenamasis namas su 10,37 arų žemės sklypu ir ūkiniais pastatais;Akmenė, NAUJOJI AKMENĖ;38 000 €
Namas Raudondvaryje;Kauno raj., Didvyrių k. vorų g;223 000 €
Puse namo;Kupiškis, Kupiškis Gedimino 78;5 000 €
Puse namo;Kupiškis, Gedimino gatve78;7 000 €
Slengių gyvenvietėje parduodamas 2 aukštų namas. Bendras plotas 170 kv.;Klaipėdos raj., Pietričių g ...;220 000 €
Parduodama sodyba Šakių r;Šakių raj., Tujų g 14, Dabitai;22 900 €
Parduodama puiki sodyba netoli Jurbarko;Šakių raj., Nemuno g 101A ...;94 900 €
Bebruliškės k. Kazlų Rūdos sav. Aušros g. 5;Kazlų Rūda, Bebruliškės k. Kazlų ...;44 400 €
Ritkūniškės k. 2, Ignalinos r.;Ignalina, Ritkūniškės k. 2 ...;25 000 €
Isnuomoju Siauliai;Šiauliai;230 €
Parduodu namą;Klaipėdos raj., Endriejavas, ...;80 000 €
Parduodamas namas su sodu 24a. Marijampoleje;;159 000 €
Atgimimo g. 3 Geležių km., Panevėžio raj.;Panevėžys, Atgimimo g. 3 ...;31 900 €
Nuoma nidoj;Neringa;20 €
Nekilnojamas turtas Tenerifėje,www.namaitenerifeje.lt;;6 500 000 €
Marijampolės r. Liudvinavo k. Paparčio 3 - oji g. 2 ( SB Papartis );Marijampolė, Marijampolės r ...;30 900 €
Kazlų Rūda - P. Vaičaičio g. 7;Kazlų Rūda, Kazlų Rūda - P ...;37 000 €
Tauralaukyje parduodamas nebaigtas statyti namas;Klaipėda, Tauralaukis;150 000 €
Parduodu namą;Kaišiadorių raj., Lomenių km,liepų51;11 000 €
Parduodu gyvenamą namą;Kaišiadorių raj., Lomenių,liepos51;11 000 €
Šakių r. sav., Griškabūdžio sen., Patamošupių k. 3;Vilkaviškio raj., Šakių r. sav ...;17 990 €
Kėdainių r. sav. Surviliškis nevėžio g. 6;Kėdainių raj., Kėdainių r. sav ...;55 000 €
Šakių r. Baltrušių k. Stasio Lozoraičio g. 20;Šakių raj., Šakių r. Baltrušių k ...;21 700 €
PARDUODAMAS NEBAIGTOS STATYBOS NAMAS PRIENŲ PAŠONĖJE, YPAČ PATIKS TIEMS, KURIE VERTINA PATOGŲ, RAMŲ GYVENIMĄ NENUTOLSTANT NUO MIESTO!;Prienų raj., Liepaloto k.;65 000 €
Varėnos R. Sav., Panočių K., Kaštonų G.;Prienų raj., Panočių K., Kaštonų ...;50 000 €
